{"$schema":"https://json-schema.org/draft/2020-12/schema","$id":"urn:harness:rollback.v1","type":"object","additionalProperties":false,"required":["schema","promotion_id","expected_active_bundle_id","rollback_target_bundle_id","safety_anchor_digest","promotion_receipt","emergency_stop","reason","evidence","sha256"],"properties":{"schema":{"const":"harness.rollback.v1"},"promotion_id":{"$ref":"#/$defs/id"},"expected_active_bundle_id":{"$ref":"#/$defs/id"},"rollback_target_bundle_id":{"$ref":"#/$defs/id"},"safety_anchor_digest":{"$ref":"#/$defs/digest"},"promotion_receipt":{"$ref":"#/$defs/promotion"},"emergency_stop":{"type":"boolean"},"reason":{"enum":["operator_requested","hard_constraint","global_kill_switch"]},"evidence":{"$ref":"#/$defs/rollback"},"sha256":{"$ref":"#/$defs/digest"}},"allOf":[{"if":{"properties":{"emergency_stop":{"const":true}}},"then":{"properties":{"reason":{"enum":["hard_constraint","global_kill_switch"]}}}}],"$defs":{"id":{"type":"string","pattern":"^[A-Za-z0-9_.:-]{1,128}$"},"digest":{"type":"string","pattern":"^[0-9a-f]{64}$"},"receipt":{"type":"object","additionalProperties":false,"required":["kind","id","digest"],"properties":{"kind":{"enum":["promotion","rollback"]},"id":{"$ref":"#/$defs/id"},"digest":{"$ref":"#/$defs/digest"}}},"promotion":{"allOf":[{"$ref":"#/$defs/receipt"},{"properties":{"kind":{"const":"promotion"}}}]},"rollback":{"allOf":[{"$ref":"#/$defs/receipt"},{"properties":{"kind":{"const":"rollback"}}}]}}}
