{"schema":"harness.rollback.v1","promotion_id":"promotion-1","expected_active_bundle_id":"challenger-1","rollback_target_bundle_id":"champion-1","safety_anchor_digest":"aaaaaaaaaaaaaaaaaaaaaaaaaaaaaaaaaaaaaaaaaaaaaaaaaaaaaaaaaaaaaaaa","promotion_receipt":{"kind":"promotion","id":"promotion-1","digest":"aaaaaaaaaaaaaaaaaaaaaaaaaaaaaaaaaaaaaaaaaaaaaaaaaaaaaaaaaaaaaaaa"},"emergency_stop":false,"reason":"operator_requested","evidence":{"kind":"rollback","id":"receipt-rollback","digest":"aaaaaaaaaaaaaaaaaaaaaaaaaaaaaaaaaaaaaaaaaaaaaaaaaaaaaaaaaaaaaaaa"},"sha256":"fa688bc7a87abb58ee2aac05137139e6ba5750fb4778e62b377074322fa2cc79"}
